{"$schema":"https://json-schema.org/draft/2020-12/schema","additionalProperties":false,"properties":{"authority_id":{"minLength":1,"type":"string"},"authority_type":{"const":"governed_enumeration_policy"},"authorized_artifact_classes":{"items":{"enum":["runtime-log"],"type":"string"},"minItems":1,"type":"array","uniqueItems":true},"enumeration_implementation":{"const":"governed_file_access_DRAFT.enumerate_directory"},"inventory_boundary":{"const":"inventory_generator_DRAFT._walk"},"primary_stream_only":{"const":true},"schema_version":{"const":"6.0.0-DRAFT"}},"required":["authority_id","authority_type","authorized_artifact_classes","enumeration_implementation","inventory_boundary","primary_stream_only","schema_version"],"title":"R4 governed enumeration","type":"object"}
